{
  "basics": {
    "name": "Jordan Rivera",
    "label": "Senior Backend Engineer",
    "email": "jordan.rivera@example.com",
    "location": {
      "city": "Denver",
      "region": "CO"
    },
    "profiles": [
      {
        "network": "GitHub",
        "username": "jrivera",
        "url": "https://github.com/jrivera"
      }
    ]
  },
  "work": [
    {
      "name": "Northwind Payments",
      "position": "Senior Software Engineer",
      "startDate": "2023-01",
      "highlights": [
        "Cut p99 checkout latency 40% for a top-10 US bank by building a Redis-backed idempotency cache in Go, raising checkout SLO compliance",
        "Mentored two new engineers through on-call onboarding"
      ],
      "x-highlights": [
        {
          "bullet_id": "b_1",
          "text": "Cut p99 checkout latency 40% for a top-10 US bank by building a Redis-backed idempotency cache in Go, raising checkout SLO compliance",
          "sources": [
            "ev_191cc8ce",
            "ev_99a74656",
            "metric:m_1"
          ]
        },
        {
          "bullet_id": "b_2",
          "text": "Mentored two new engineers through on-call onboarding",
          "sources": [
            "ev_cbf558fa"
          ]
        }
      ]
    },
    {
      "name": "Tailspin Toys",
      "position": "Software Engineer",
      "startDate": "2019-06",
      "endDate": "2022-12",
      "highlights": [
        "Migrated the order service from PHP to Go, serving 2M requests per day"
      ],
      "x-highlights": [
        {
          "bullet_id": "b_3",
          "text": "Migrated the order service from PHP to Go, serving 2M requests per day",
          "sources": [
            "resume:/work/1/highlights/0"
          ]
        }
      ]
    }
  ],
  "projects": [
    {
      "name": "ledger-lint",
      "url": "https://github.com/jrivera/ledger-lint",
      "startDate": "2021-04",
      "highlights": [
        "Built ledger-lint, an open-source linter for double-entry ledger files with 300 GitHub stars"
      ],
      "x-highlights": [
        {
          "bullet_id": "b_4",
          "text": "Built ledger-lint, an open-source linter for double-entry ledger files with 300 GitHub stars",
          "sources": [
            "resume:/projects/0/description"
          ]
        }
      ]
    }
  ],
  "education": [
    {
      "institution": "State University",
      "area": "Computer Science",
      "studyType": "BS",
      "endDate": "2019"
    }
  ],
  "certificates": [
    {
      "name": "AWS Certified Solutions Architect - Associate",
      "date": "2024-05",
      "issuer": "Amazon Web Services"
    }
  ],
  "skills": [
    {
      "name": "Backend",
      "keywords": [
        "Go",
        "Python",
        "Redis",
        "PostgreSQL"
      ]
    }
  ]
}
